{
  "case_id": "GOLDEN_002",
  "policy_id": "DUS_BALCONY_PV_2025",
  "project_type": "BALCONY_PV",
  "costs": {
    "currency": "EUR",
    "buckets": {
      "HARDWARE": {
        "amount": "800.00",
        "amount_basis": "GROSS"
      },
      "LABOR": {
        "amount": "0.00",
        "amount_basis": "GROSS"
      }
    }
  },
  "timeline_events": [
    {
      "event_type": "APPLICATION_SUBMITTED",
      "date": "2026-02-01"
    },
    {
      "event_type": "CONTRACT_SIGNED",
      "date": "2026-02-05"
    },
    {
      "event_type": "WORK_STARTED",
      "date": "2026-02-10"
    }
  ]
}
